,Date,Type,Dead,Injured,Location,Details,Perpetrator,Part of
0,January 21,"Suicide car bombing, shooting",36–190 (+3),58–70,"Maidan Shar, Afghanistan","Maidan Shar attack: A defense ministry official stated 126 security personnel were killed and around 70 others were injured, when the Taliban attacked a military checkpoint in Maidan Shar. The assault began when an attacker rammed a vehicle full of explosives in the compound, then two other attackers stormed the compound and opened gunfire, before being killed. A Taliban spokesman claimed responsibility and stated 190 personnel were killed.[1][2][3] National Directorate of Security's reports however showed only 36 killed and 58 injured.[4]",Taliban,War in Afghanistan
1,February 10–11,Shooting,141,Unknown,"Kajuru, Nigeria","2019 Kaduna State massacre: An attack on an Adara settlement named Ungwar Bardi by suspected Fulani gunmen killed 11. Reprisal attack by an Adara militia targeted settlements of the Fulani. The death toll rose to 141 a few days later with 11 Adara and 130 Fulani dying per the government. The governor spoke that the motive was to destroy specific communities. The attacks took place in Kajuru LGA of Kaduna State. Miyetti Allah was reported to have published a list of 131 dead, but later clarified that 66 Fulani were buried and 65 remain missing.[5][6][7][8][9]",Fulani gunmen (suspected) and Adara militia,Communal conflicts in NigeriaHerder–farmer conflicts in Nigeria
2,March 23,Shooting,160,70+,"Bankass, Mali",March 2019 attacks against Fulani herders: 160 Fulani herders were killed in an attack launched on the village of Ogossagou and Welingara near the town of Bankass. The attackers were dressed as Dozo Hunters and the attack appeared to have been ethnically motivated.[10][11][12],Dozo Dogon militia,Northern Mali Conflict
3,April 21,Bombings,259[13],500+,"Colombo, Negombo &amp; Batticaloa, Sri Lanka","2019 Sri Lanka Easter bombings: A series of explosions were reported at three churches and three hotels in several cities in Sri Lanka, including the capital Colombo. 259 people, including at least 45 foreign nationals, were killed and more than 500 were injured.[14][15] The church bombings occurred during Easter mass in Negombo, Batticaloa and Colombo while the three hotels targeted were the Shangri-La, Cinnamon Grand and Kingsbury hotels in Colombo.[16][17][18]",National Thowheeth Jama'ath possibly with the help of the Islamic State[19],Terrorism in Sri Lanka
4,June 3–10,"Shooting, melee attack, stabbing, vehicular attack",118,650+,Khartoum and other places in Sudan,"Khartoum massacre: Unarmed protestors were attacked by security forces and paramilitary forces during a sit-in. The opposition says 118 people were killed, but the authorities put the death toll at 62. The exact number of deaths is difficult to say because a lot of bodies were dumped in the Nile. Hundreds of people became injured and a lot of people were raped. More people were killed in violence the next days across the country.[20][21][22][23][24]","TMC security forces, RSF",2018–19 Sudanese protests
5,June 10–17,"Shooting, attacks, massacres",240+,Unknown,"Ituri Province, Democratic Republic of the Congo","Over 240 people were killed in attacks on villages and communities and ethnic clashes between Lendu and Hema tribes in the volatile Ituri Province. The attackers were mostly from the Lendu tribe, with the attacks primarily targeting Hema civilians, but police officers were also targeted. According to reports, the attacks on Hema villagers were in response to the killing of four Lendu businessmen on June 10, which the Lendu considered to be assassinations by Hema militiamen. 160 bodies were found in a mass grave in the village of Tche, with others found elsewhere.[25][26][27][28][29]",Lendu and Hema militias,Ituri conflict
